"country","England without London","London","Scotland","Wales","Great Britain"
"Average annual change in income","3.793249","4.735561","4.704459","5.099822","4.219404"
"Change in income since previous year","4.447759","6.417650","6.745220","2.896718","5.266775"
"Average annual change in expenditure","1.6473647","0.4690459","2.2236478","1.9856571","1.3001817"
"Change in expenditure since previous year","3.577538","5.081639","9.026318","2.743729","4.297601"
"Average annual change in surplus"," 6.439031"," 8.197532"," 7.452372","11.601113"," 7.310492"
"Change in surplus since previous year","5.421135","7.337336","4.605093","3.153139","6.171282"
